lang,edit_history_tweet_ids,author_id,created_at,text,id
en,['1585687448901779467'],1908383365,2022-10-27T17:38:43.000Z,"Thompson #rcmpmb responded last night to a structure fire on Queens Bay that injured a 41yo female, a 62yo male &amp; a 13yo female. 3 boys (9,7,4) and a girl (10), who were found upstairs, were taken to hospital where they were pronounced deceased. Info @ https://t.co/IbxpTeGSDM https://t.co/wqAc6P3mif",1585687448901779467
en,['1585630247545753600'],1908383365,2022-10-27T13:51:25.000Z,Stacey Houle has been safely located. The #rcmpmb thanks the public and the media for their assistance.,1585630247545753600
en,['1585305451452715010'],1908383365,2022-10-26T16:20:47.000Z,"Alexander Canard, 38, is WANTED for Possession of Weapon for a Dangerous Purpose &amp; is on the #rcmpmb Most Wanted list. See his profile &amp; others at https://t.co/N8F0wR68Tb. Have info? Call your local police or Crime Stoppers at 1-800-222-8477 (TIPS). #WantedWed https://t.co/vIDW5Nnouc",1585305451452715010
en,['1585257822261981185'],1908383365,2022-10-26T13:11:32.000Z,George Fortin has been safely located. #rcmpmb thanks the public and the media for their assistance.,1585257822261981185
en,['1585073755214184449'],1908383365,2022-10-26T01:00:07.000Z,"There is simply no excuse (and the driver didn’t have one)…

At 8pm on October 21, a 17yo was caught in St-Pierre-Jolys going 122 km/h in a 50 km/h zone on #MBHwy59.  Fined $992 + serious offence notice for licence review with MPI. #noexcuses #rcmpmb #TrafficTues https://t.co/JbsWUQif0f",1585073755214184449
en,['1585001925837459457'],1908383365,2022-10-25T20:14:41.000Z,Tia Osborne has been safely located. #rcmpmb thanks the public and the media for their assistance.,1585001925837459457
en,['1584978608736460800'],1908383365,2022-10-25T18:42:02.000Z,"On Oct 24 an investigation into threats led officers to execute a search warrant at a home on Shamattawa First Nation. Firearms &amp; ammo were seized. A 24yo male is facing charges of Pointing a Firearm, Assault with a Weapon &amp; firearm offences. #rcmpmb continue to investigate. https://t.co/kxzxQKtuZj",1584978608736460800
en,['1584932784136589313'],1908383365,2022-10-25T15:39:57.000Z,"On Oct 20, Steinbach #rcmpmb, in a joint effort with @BCRCMP, located &amp; arrested 27yo Quinten Meyer, who was listed as #24 on Canada’s Top 25 most wanted list. He had multiple warrants out for his arrest from MB, AB &amp; BC w/ over 20 charges outstanding. He was remanded in custody. https://t.co/Gx26KPJkYm",1584932784136589313
en,['1584620125734719488'],1908383365,2022-10-24T18:57:33.000Z,"Oct 21, at 10:55 pm, 3 males drowned on the Churchill River at a remote fishing cabin, near Leaf Rapids. One male fell off the dock into the water, &amp; two males jumped in to help. They all began to struggle &amp; drowned. They were aged 49, 51 &amp; 54. #rcmpmb continue to investigate. https://t.co/qeigQlKSs9",1584620125734719488
en,['1584610084596109313'],1908383365,2022-10-24T18:17:39.000Z,"Arriving at work on Oct21, employee at Portage la Prairie biz heard cries for help in the ceiling. Turns out Daniel Francis, 30, got stuck after entering the venting system from the rooftop. #rcmpmb charged him with Break &amp; Enter &amp; Mischief Over $5000 once he was extricated https://t.co/5HylNSwpYh",1584610084596109313
en,['1584584647652311040'],1908383365,2022-10-24T16:36:34.000Z,"On Oct 20, Island Lake #rcmpmb responded to a report of a deceased male on the Garden Hill First Nation. A 40yo male was located in the water. Over the weekend, 26yo Terry Monias was arrested &amp; charged w/ 2nd Deg Murder. 3 other males were charged w/ Accessory After the Fact. https://t.co/4ef228FHc1",1584584647652311040
en,['1583845231644250112'],1908383365,2022-10-22T15:38:24.000Z,Update-Kingsley Campbell has been arrested. The #rcmpmb thanks the public and the media for their assistance. https://t.co/vH6B9ILuJC,1583845231644250112
en,['1583525810170105856'],1908383365,2022-10-21T18:29:08.000Z,"Oct 19, at 1:40 am, a semi was going east on the Perimeter Hwy near St. Anne’s Rd when a pedestrian walked onto the roadway &amp; was struck. The pedestrian died at the scene. #rcmpmb are in the process of confirming the identity. The driver of the semi was not physically injured.",1583525810170105856
en,['1583515330764120064'],1908383365,2022-10-21T17:47:29.000Z,"Investigators are asking anyone who may have reached out before or may have new information, in relation to his disappearance, to contact the Nelson House #rcmpmb @ 204-484-2837, Crime Stoppers anonymously @ 1-800-222-8477, or a secure tip online @ https://t.co/FJlgR4y7IJ https://t.co/Nif5gPVFZb",1583515330764120064
en,['1583515195145883648'],1908383365,2022-10-21T17:46:57.000Z,"Nelson House #rcmpmb, along w/ Major Crime Services, continue to investigate the homicide of Rico Linklater, last seen one year ago today. In early Sept, the Underwater Recovery Team along w/ Search &amp; Rescue attended to Nelson House to assist in furthering this investigation…",1583515195145883648
en,['1583479135380574210'],1908383365,2022-10-21T15:23:40.000Z,"Correction: Jan 12, 2022 https://t.co/6iKvVpwOp0",1583479135380574210
en,['1583458879337222146'],1908383365,2022-10-21T14:03:10.000Z,"We urge anyone who may have information to call Manitoba #rcmpmb Major Crime Services at 431-489-8551, or call Crime Stoppers anonymously at 1-800-222-8477, or secure tip online at https://t.co/FJlgR4y7IJ.",1583458879337222146
en,['1583458876703518721'],1908383365,2022-10-21T14:03:10.000Z,"“We’re confident people saw &amp; helped them during the 2000 km from Toronto to Emerson. We need these people to come forward &amp; share what they know about the Patel family’s journey within Canada.” - Sgt Bird, #rcmpmb Major Crime Services",1583458876703518721
en,['1583458870617260033'],1908383365,2022-10-21T14:03:08.000Z,"Video shows Patel family at @TorontoPearson on Jan 12, 2002. #rcmpmb believe Patel family left Toronto area shortly before their bodies were discovered near Can-US border on Jan 19. But it’s unknown how they travelled from TO to MB (air/rail/bus have been checked). https://t.co/OpZx8Ff1TN",1583458870617260033
en,['1583172216409423872'],1908383365,2022-10-20T19:04:04.000Z,"#rcmpmb have identified the remains located in the Oct 17 Birch River fire as a 68yo male. His death is being investigated as a homicide. On Oct 18, 21yo Lincoln Chartrand-Flett, was arrested &amp; charged w/ 2nd Deg. Murder. He was remanded in custody for court on Oct 25 in Dauphin. https://t.co/6haPGLp7dw",1583172216409423872
en,['1583106684049707010'],1908383365,2022-10-20T14:43:40.000Z,"Over Thanksgiving weekend, Manitoba #rcmpmb conducted “Operation Impact” which focussed on the high risk driving behaviours that contribute to serious &amp; fatal motor vehicle collisions. So far this year, 65 people have died in collisions. See results here @ https://t.co/mVzy7Imj8v https://t.co/WF09XAW21g",1583106684049707010
en,['1582828310077526016'],1908383365,2022-10-19T20:17:31.000Z,"Claudia Sumner, 21, is WANTED for Kidnapping with a Firearm. See her profile and all the others at https://t.co/N8F0wRoi7j. Do you have info? Recognize someone? Call your local police, RCMP or Crime Stoppers at 1-800-222-8477 (TIPS). #WantedWed https://t.co/Vjmv6Y0Hjm",1582828310077526016
en,['1582810386125889536'],1908383365,2022-10-19T19:06:17.000Z,"We appreciate the outpouring of sympathy for the loss of our colleague &amp; friend, Cst Shaelyn Yang. For those who wish to sign our book of condolences, please visit ""D"" Division HQ in Wpg, 1091 Portage Ave, or via email at RCMP.Condolences-Condoleances.GRC@rcmp-grc.gc.ca. #rcmpmb https://t.co/bfiVzJJmwY",1582810386125889536
en,['1582791347387666432'],1908383365,2022-10-19T17:50:38.000Z,"In the vehicle, officers located 101 grams of cocaine &amp; over $12,000.00 in cash. 34yo Sean-Leo Monchalin was remanded into custody. In the last 3 weeks, Norway House #rcmpmb have seized over 350 grams of cocaine, 330 rocks of crack cocaine, two 9mm handguns &amp; over $38,000.00. https://t.co/9Is2j9oivE",1582791347387666432
en,['1582791213593133056'],1908383365,2022-10-19T17:50:06.000Z,"On Oct 17, Norway House First Nation Safety Officers attempted to stop a vehicle observed driving erratically. The vehicle failed to stop &amp; hit the ditch where the driver fled on foot into a wooded area. He was pursued by FNSO’s &amp; #rcmpmb &amp; arrested w/o incident @ a nearby home…",1582791213593133056
en,['1582752291248955392'],1908383365,2022-10-19T15:15:27.000Z,Update- Jesse Myles St. Paul has been arrested. The #rcmpmb thanks the public and the media for their assistance. https://t.co/PR4gPjtCJH,1582752291248955392
en,['1582731631609380865'],1908383365,2022-10-19T13:53:21.000Z,"Oct 16, Dauphin #rcmpmb received a report of a suspicious vehicle believed to be involved in a number of thefts in the Ochre River area. The suspect vehicle was located &amp; failed to stop for police. A spike belt was deployed &amp; the vehicle stopped. Info: https://t.co/eI9ERLvQGe https://t.co/frPDB5QYUX",1582731631609380865
