id,author_id,edit_history_tweet_ids,text,lang,created_at
1595957441740488704,9973392,['1595957441740488704'],Want to email PDF and MOBI files directly to your @Amazon Kindle? You can! You just need to identify its unique @KINDLE.COM email address. Here's how to find it (and a few other cool settings to check out too): https://t.co/su40d0oIsO #kindle #ebooks #mobi #epub https://t.co/ejoIlkGOrR,en,2022-11-25T01:48:00.000Z
1595954925225144321,9973392,['1595954925225144321'],"One of the many secret features of Facebook for Mobile is a map of free wifi hotspots. Here's how to find it, and a better alternative that you already have installed on your mobile device: https://t.co/HugBPWtUG7 #facebook #wifi #hotspots #freewifi #maps #mapping @Facebook https://t.co/YCOjUtmyWU",en,2022-11-25T01:38:00.000Z
1595950143479713793,9973392,['1595950143479713793'],"You don't need any third-party apps or utilities to update your PC profile picture! Here's how to find the right spot in Settings to change it, and @Windows Camera to get great results: https://t.co/F7yyIioXsW #windows #pc #personalization #profiles #selfies https://t.co/PIZk4GHGb5",en,2022-11-25T01:19:00.000Z
1595945362644209667,9973392,['1595945362644209667'],"When I asked Smartish to send an iPhone case, they were so enthusiastic they sent me ALL their products! Here's how I navigated through their terrific accessories, with a focus on power and charging gear: https://t.co/CRrth1tk27 #iphone #charger #qicharging #smartish Smartish https://t.co/Sg4Z7nJL3e",en,2022-11-25T01:00:00.000Z
1595941587673980928,9973392,['1595941587673980928'],"""Nearby Share"" isn't just for Android to @Android file sharing; it also works with Chromebooks too! Here's how to use it to transfer photos from phone to computer with just a few taps: https://t.co/k05aWR59AX #chromeos #chromebook #android #nearbysharing #filesharing https://t.co/DrSbVwIWRw",en,2022-11-25T00:45:00.000Z
1595937057393762304,9973392,['1595937057393762304'],"Need to unpair and have a Mitsubishi car or truck forget your bluetooth smartphone? Android or iPhone, here's how to get it done, tap by tap... https://t.co/VSXvU2ZBoB #mitsubishi #infotainment #bluetooth #pairing #privacy @mitsucars https://t.co/7IH00XNJI7",en,2022-11-25T00:27:00.000Z
1595934289249460227,9973392,['1595934289249460227'],Does turkey actually contain tryptophan and is there enough that a regular portion will actually make you sleepy? I derail the usual tech convo for an exploration of this oh-so-Thanksgiving topic: https://t.co/LDtgQm1xmS #food #turkey #tryptophan #thanksgiving https://t.co/r7qVTY3UMG,en,2022-11-25T00:16:00.000Z
1595931521453637632,9973392,['1595931521453637632'],"Soundpeats took their popular Air3 Deluxe earbuds and added Hi-Res Audio, making them some of the best-sounding under-$50 earbuds in the market. Here's my review to whet your appetite: https://t.co/1ik2nOHgLd #soundpeats #earbuds #hiresaudio #tws @Soundpeats https://t.co/qFGXbCS9N5",en,2022-11-25T00:05:00.000Z
1595925229481603072,9973392,['1595925229481603072'],"There are a lot of nifty features you can add to your Windows 11 lock screen, including a weather forecast. You can also choose a favorite photo or a gallery of landscapes! Here's the scoop: https://t.co/5lyDrohmuQ #windows #win11 #lockscreen #personalization #weather https://t.co/x8jYOUvKb1",en,2022-11-24T23:40:00.000Z
1595922964783964160,9973392,['1595922964783964160'],"Wish your favorite audio device had Bluetooth capabilities, or want to use your new ANC Bluetooth headphones on the plane or TWS earbuds at the gym? Then you'll love the AirFly Pro from Twelve South! My review: https://t.co/ZEIA5rn7Fi #audio #audiophile #bluetooth @twelvesouth https://t.co/aaEkZHwWzm",en,2022-11-24T23:31:00.000Z
1595915415137525760,9973392,['1595915415137525760'],Ready to plug your @Android phone into your car and enjoy Android Auto? Here's how to get it all set up and working properly on the first try (with some critical rental car security tips too): https://t.co/AK5RGt8QfL #android #androidauto #toyota https://t.co/XbB2k2M0kJ,en,2022-11-24T23:01:00.000Z
1595911136687161345,9973392,['1595911136687161345'],"Spend lots of time on the phone in the car, a warehouse, factory, or home office? You'll love the EKSA H1 Plus Trucker Bluetooth Headset with its slick AI-powered environmental noise-canceling features: https://t.co/IdVQQmbpBQ #eksa #telephony #headset #bluetooth @EKSAtech https://t.co/tD5XU2cgeD",en,2022-11-24T22:44:00.000Z
1595907615350931456,9973392,['1595907615350931456'],Does turkey actually contain tryptophan and is there enough that a regular portion will actually make you sleepy? I derail the usual tech convo for an exploration of this oh-so-Thanksgiving topic: https://t.co/LDtgQm1xmS #food #turkey #tryptophan #thanksgiving https://t.co/A3xK61rJtH,en,2022-11-24T22:30:00.000Z
1595903335340580864,9973392,['1595903335340580864'],"Did you know that the Microsoft program ""Phone Link"" makes it a breeze to remotely manage and control your Android phone from your PC? It's pretty darn slick. Here's how to get started: https://t.co/jG7iYZeIpZ #windows #android #phonelink https://t.co/5LKOk2AZZ9",en,2022-11-24T22:13:00.000Z
1595897547138048000,9973392,['1595897547138048000'],"Bought yourself an Amazon Kindle? Congrats! Here's a step-by-step guide to buying your first ebook through the Kindle Store, with a focus on saving $$ through the Deals section: https://t.co/dpN5wUqZ9K #amazon #kindle #ebook @AmazonKindle https://t.co/wryBLWXdhd",en,2022-11-24T21:50:00.000Z
1595892765568552961,9973392,['1595892765568552961'],"It used to be easy to schedule future Google Hangouts from within Gmail, but Google Meet makes it a bit more tricky. Here's how to plan your meets hours, days, or even weeks in advance: https://t.co/p2IH6oztHR #gmail #hangouts #googlemeet #calendar #uiux https://t.co/bgb7QyXhGL",en,2022-11-24T21:31:00.000Z
1595887732466802692,9973392,['1595887732466802692'],"Do your Zoom calls and meetings sometimes pick up unwanted guests? Here's how to schedule and tighten up your @Zoom meeting security, step by step: https://t.co/dQeasBQX17 #zoom #meetings #security https://t.co/gb8Z10dEiG",en,2022-11-24T21:11:00.000Z
1595880434440830977,9973392,['1595880434440830977'],"Hey Ubuntu Linux fans! Does the system beep drive you around the bend when you're working, particularly in Terminal? Turns out there are many ways to tweak or mute it. Here are a couple of my favorites: https://t.co/3jTCSxiZUj #linux #ubuntu #errors #uiux https://t.co/uHkSSN6Y4w",en,2022-11-24T20:42:00.000Z
1595874646083006465,9973392,['1595874646083006465'],Ready for a new outdoor adventure watch but want one that lets you unplug from the online world? Then you'll love the newest Casio PRO TREK PRG340. Here's my detailed demo and review: https://t.co/bq0xAZnkoq #casio #protrek #watches #trekking #outdoors @Casio_USA @Protrek_usa https://t.co/rablb50Ndr,en,2022-11-24T20:19:00.000Z
1595865838342443008,9973392,['1595865838342443008'],Tech 101: Is a friend telling you that your computer's slow because you have too little ROM? Confused about RAM and ROM versus SSD? Here's the scoop on all these memory nuances: https://t.co/faJl92xoD4 #ram #rom #memory #ssd https://t.co/rDy2C8zH0q,en,2022-11-24T19:44:00.000Z
1595855520627294208,9973392,['1595855520627294208'],"Ever wanted to use your iPhone as a webcam with your Mac system? You can! Here's how to use Continuity Camera, with lots of tips for best results too: https://t.co/CQtWCMdLxZ #mac #iphone #camera #webcam #continuitycamera #macos #ios https://t.co/Wnu2kYa3T2",en,2022-11-24T19:03:00.000Z
1595847467395911681,9973392,['1595847467395911681'],Love the people in your photographs but hate the backgrounds? @AdobeExpress offers a powerful free online tool to fix 'em. Here's how I used it to fix up one of my own selfies... https://t.co/K11Dp6G00N #adobe #adobeexpress #photography https://t.co/gLPii0MG1Y,en,2022-11-24T18:31:00.000Z
1595840421233451008,9973392,['1595840421233451008'],"More iPhone cases! Part two of my iPhone 14 Pro roundup review includes @Skinit, @OtterBox, Mujjo, and @GelaSkins, all sporting their best and most interesting designs. It's a caseapalooza! https://t.co/ASNngUeS5h #iphone #iphone14pro #gelaskins #skinit #otterbox @MujjoStore https://t.co/TCLLQjfrFW",en,2022-11-24T18:03:00.000Z
1595834632846516224,9973392,['1595834632846516224'],"Who makes the best rugged iPhone 14 case? I compare almost a dozen from @OtterBox, @SpeckProducts, Smartish, Catalyst and more, to figure out which is best for your new phone: https://t.co/JFO1ZvB5bA #iphone #iphone14 #Smartish #catalyst #torras #cases #phonecase https://t.co/cnbQKmNQab",en,2022-11-24T17:40:00.000Z
1595827082872983552,9973392,['1595827082872983552'],"You don't have to compromise on audio quality, comfort, battery life, or ANC with the @Soundpeats Air3 Pro wireless earbuds. And, as a bonus, they're affordable too! Here's my demo and review: https://t.co/s3L8fIxkMK #soundpeats #audio #anc #earbuds https://t.co/8SOnJGcEvy",en,2022-11-24T17:10:00.000Z
1595816764683653120,9973392,['1595816764683653120'],"Spend a lot of time on the phone or on Zoom and Slack? Then you'll really want to learn more about the @CyberAcoustics ""Essential"" Bluetooth Headset. Here's my demo and review: https://t.co/lsiWsnAZkt #cyberacoustics #headset #bluetooth #telephony https://t.co/LMrVlpqljg",en,2022-11-24T16:29:00.000Z
1595617954955087873,9973392,['1595617954955087873'],The rubyoung Hi-Fi Bluetooth Speaker I evaluate in this video has the best sound of any portable audio system I've heard. You'll want to learn more about this audiophile marvel: https://t.co/Hi6jipfNFW #rubyoung #audiophile #speakers #audio https://t.co/eEhe4TM8zy,en,2022-11-24T03:19:00.000Z
