id,author_id,created_at,text,edit_history_tweet_ids,lang
1589241129139990528,113380026,2022-11-06T12:59:46.000Z,"Black River Wine Bar in Quakertown:
Our Wine Bar is Two!
Cheers to TWO years! 🍷
Come celebrate this weekend with us and enjoy a wine flight, wine slushie &amp; bottles to go!
In celebrating this event we are offering 2$ off any ✌️ bottles of Trolley Wines!
We hope to see you soon!",['1589241129139990528'],en
1589007582101905408,113380026,2022-11-05T21:31:44.000Z,"If you missed PA Bacon Fest in downtown Easton today, you can catch the team from Blue Mountain Vineyards tomorrow at their booth in the 200 block of Northampton Street from 10 am - 5 pm. https://t.co/oSyfmNQIjX",['1589007582101905408'],en
1588905726302248961,113380026,2022-11-05T14:47:00.000Z,"One week from today is our annual Giving Before Thanks event along the #LVWT! 
We hope you will join us to support local families by donating non-perishable food at each of our 5 member wineries and you'll receive a complimentary tasting of 3 wines.
https://t.co/4MzDXBqvU2 https://t.co/ttRpNfWlst",['1588905726302248961'],en
1588876533996871682,113380026,2022-11-05T12:51:00.000Z,"Tolino Vineyards at the Easton Public Market -
Did somebody say BACON??! 🥓 
Well say it again!  Visit us inside the Easton Public Market this weekend 11/5-11/6! Mention “Bacon Fest” to receive 10% off bottle purchases!! Wine pairs perfectly with bacon! 🍷🥓",['1588876533996871682'],en
1588658496387645448,113380026,2022-11-04T22:24:36.000Z,RT @thevalleyledger: LEHIGH VALLEY WINE TRAIL GIVING BEFORE THANKS EVENT TO HELP FILL SHELVES AT TWO AREA FOOD BANKS IN TIME FOR THANKSGIVI…,['1588658496387645448'],en
1588637477987827712,113380026,2022-11-04T21:01:04.000Z,Headed to @PABaconFest in #EastonPA this weekend? Visit the Blue Mountain Vineyards booth in the 200 block of Northampton Street. https://t.co/dWmUniG7Jl,['1588637477987827712'],en
1588617479726710785,113380026,2022-11-04T19:41:36.000Z,"Passports for the Wine &amp; Shine Lehigh Valley passport program go on sale soon. You'll be able to buy them for $39 each at all participating venues (cash only), or online thru EventBrite.
More info coming soon! https://t.co/XyYrRadI6w",['1588617479726710785'],en
1588563178170073089,113380026,2022-11-04T16:05:50.000Z,You can still score those Tolino wine-infused chocolate truffles at Chocodiem inside the Easton Public Market! https://t.co/lGXPwtyVMw,['1588563178170073089'],en
1588522786691158022,113380026,2022-11-04T13:25:20.000Z,"From Franklin Hill Vineyards: Warm weather in the fall 🍂calls for a Harvarita!  A delicious blend of our sangria in a bottle Fiesta 🪅 with @socialstill Blanco a bit of cranberry juice, a squeeze of lime and an agave brown sugar rim.  Available exclusively at the winery. https://t.co/A3QefUcfxG",['1588522786691158022'],en
1588333958793527296,113380026,2022-11-04T00:55:00.000Z,"Nosh on a tasty charcuterie tray during your next visit to Vyencrest in Breinigsville. It's the perfect food to pair with your glass of wine.
https://t.co/nrYurEOjXF https://t.co/LKh97EoQZM",['1588333958793527296'],en
1588318859454550016,113380026,2022-11-03T23:55:00.000Z,"The @FranklinHillVin wine you love is easy to find at many regional grocery stores. 
So when you can't make it to the winery in Bangor or their tasting rooms in Easton, Bethlehem and Bartonsville, hit up your favorite grocery store instead! https://t.co/iM2wvPHBLq",['1588318859454550016'],en
1588303759855058944,113380026,2022-11-03T22:55:00.000Z,"Get crafty with a #winecocktail recipe this weekend. Find recipes that you can experiment with on the LVWT web site here:
https://t.co/eRP4kA4wgA https://t.co/nl5C1f3H2r",['1588303759855058944'],en
1588288657248907264,113380026,2022-11-03T21:54:59.000Z,"Harvest season is now over and it will soon be time for our wineries to switch into holiday mode. 
But no matter what time of year, it's always a good time to travel the wine trail. https://t.co/MV2T1qSy3y https://t.co/d8V7dP3cJ1",['1588288657248907264'],en
1588255407386116097,113380026,2022-11-03T19:42:52.000Z,"Santa in a Big Rig &amp; Craft Event at Tolino Vineyards
Join us for Santa arriving in a big rig and a wagon ride with Santa (weather permitting). Kids: $10 and includes cookie and juice, Christmas craft, short wagon ride with Santa and picture op with Santa. https://t.co/0I7ToupVZe",['1588255407386116097'],en
1588214169622392832,113380026,2022-11-03T16:59:00.000Z,"Have you peeked ahead to the weekend weather yet? 
It's looking great! Unseasonably warm for early November. 
Get out there and enjoy it with us! All five LVWT wineries will be open this Friday - Sunday and ready to welcome you. 
Make your plans now: https://t.co/O4VzHipf5p https://t.co/oWstDk1m3c",['1588214169622392832'],en
1588201140780408832,113380026,2022-11-03T16:07:13.000Z,"The fall foliage in #lehighvalleypa may begin to fade now, but there's still a lot of it left to see and a great weather weekend is on tap. 
Join us for a weekend of wine tastings along the #LVWT.
https://t.co/JyaAZ6xON9 https://t.co/zHBiP00Lpj",['1588201140780408832'],en
